26C;JARDIM BERLEZE TERRA NOVA MORADAS
226E;JARDIM BERLEZE ZILDA ARNS VIA RES DOM IVO LOSCHEISTER
226F;JARDIM BERLEZE INVERTIDO ZILDA ARNS VIA RES DOM IVO LOSCHEISTER
226T;JARDIM BERLEZE INVERTIDO TERRA NOVA ZILDA ARNS VIA RES DOM IVO LOSCHEISTER
226L;JARDIM BERLEZE INVERTIDO TERRA NOVA MORADAS
226M;JARDIM BERLEZE VIA ZILDA ARNS RES DOM IVO LOSCHEISTER TERRA NOVA SAI DO MANECO
226H;JARDIM BERLEZE TERRA NOVA ZILDA ARNS VIA DOM IVO LOSCHEISTER
226B;JARDIM BERLEZE INVERTIDO
226J;JARDIM BERLEZE INVERTIDO SAI DO MANECO TERRA NOVA
0226;JARDIM BERLEZE